,Unnamed: 0,id,domain,type,url,content,scraped_at,inserted_at,updated_at,title,authors,keywords,meta_keywords,meta_description,tags,summary
0,0,141,awm.com,unreliable,http://awm.com/church-congregation-brings-gift-to-waitresses-working-on-christmas-eve-has-them-crying-video/,sometimes power christmas make you do you do not need believe holy believe power doing good for others simple act giving is lost many us these days about us from giving others who are need congregation ohio moved action by power at their church christmas eve at church ohio an about message jesus  for many people message jesus is help others make sure people who are help need little really about generosity that look like our lives jesus time his time  but act look like our that  not lost congregation who were moved had take action congregation take an offering everyone could christmas eve with their  did do with offering congregation waffle house ladies working choice most holy days everyone be with their families  ladies working at waffle house were not with their families had choice but holy day because it congregation understood being by these ladies help entire offering be split amongst ladies at waffle house  that NUM being split amongst about his doing good like christmas really felt by ladies working at waffle house sure could not their families but at little from good people their community  about that congregation did not it simple act generosity from people who understood pain being felt by that pain it about church our lives simple act entire community because it most day year,2018-01-25 16:17:44.789555,2018-02-02 01:19:41.756632,2018-02-02 01:19:41.756664,"Church Congregation Brings Gift to Waitresses Working on Christmas Eve, Has Them Crying (video)",Ruth Harris,,[''],,,
1,1,256,beforeitsnews.com,fake,http://beforeitsnews.com/awakening-start-here/2018/01/awakening-of-12-strands-of-dna-reconnecting-with-you-movie-10623.html,awakening NUM  reconnecting with   is your   blockchain blockchain are  DATE NUM  URL  was was strange synchronicities and  in NUM we in was strange NUM  URL  URL  are NUM our and is our  NUM  full video is video vimeo  NUM  reconnecting with  URL  NUM  reconnecting with vimeo  we full video strange synchronicities we your in  URL  ,2018-01-25 16:17:44.789555,2018-02-02 01:19:41.756632,2018-02-02 01:19:41.756664,AWAKENING OF 12 STRANDS of DNA – “Reconnecting with You” Movie,Zurich Times,,[''],,,
2,2,700,cnnnext.com,unreliable,http://www.cnnnext.com/video/18526/never-hike-alone-a-friday-the-13th-fan-film-full-movie-/,never NUMth usa  NUM  NUM min tribute NUMth follows an adventure  NUMth usa  NUM  NUM min    tribute NUMth follows an adventure mcleod andrew leighty who lost camp on  his he camp mass jason voorhees  in with jason on his his he  hell up another lost camp     vincente     vincente mcleod    on characters created        andrew leighty mcleod  vincente jason voorhees    producers    sarah    producers         christopher thellas  thellas    producers   ascencio  ascencio       photography  christopher thellas      production     up           jason voorhees  mcleod      sarah    photography         hell  written vincente gonsalves machado  performed gonsalves machado  recorded at new bedford ma NUM  appears courtesy    another  written performed trevor vaughan  appears on  recorded at new bedford ma NUM  appears courtesy trevor vaughan  mass      URL    URL       this production is womp stomp films its  is in no with or new NUMth or its characters      this project created fans fans NUMth  NUMth DATE this project be made all who  no be made its      thank you all who in project  womp stomp films is project    thank you watching,2018-01-25 16:17:44.789555,2018-02-02 01:19:41.756632,2018-02-02 01:19:41.756664,Never Hike Alone - A Friday the 13th Fan Film (Full Movie),,,[''],"Never Hike Alone: A Friday the 13th Fan Film     USA | 2017 | 54 minA fan tribute to Friday the 13th, Never Hike Alone follows an adventure blogger, Kyle McLeod",,
3,3,768,awm.com,unreliable,http://awm.com/elusive-alien-of-the-sea-caught-by-scientist-for-one-of-the-first-times-ever-video/,when scientists for unique feature not that can at or for time sharks unique that can jaw telescoping if movie alien that monster on prey lashes out with telescoping teeth fish them one deep sea  telescoping teeth can only NUM first just few have been  but during five sharks  feature are teeth like viper name  viper as you can name with prey  although researchers have their on few known about them but researchers think creatures swim NUMNUM meters surface ocean during day NUM meters below at could be because or do with  five specimens up from NUM meters below surface sea but but could not just day  viper sharks like alien monster from movie they do not on their are one their creatures be because their when they swim lashes out with jaw fish up  first specimens viper NUM seiryomaru first creatures up surface sea  because fish at time scientific name seiryomaru sharks scientific name  although not about fish are known scientists them as they have only been deep ocean  would you if up on would you think you nightmare,2018-01-25 16:17:44.789555,2018-02-02 01:19:41.756632,2018-02-02 01:19:41.756664,Elusive ‘Alien Of The Sea ‘ Caught By Scientist For One Of The First Times Ever (video),Alexander Smith,,[''],,,
4,4,791,bipartisanreport.com,clickbait,http://bipartisanreport.com/2018/01/21/trumps-genius-poll-is-complete-the-results-have-americans-bursting-with-laughter/,donald trump ability ability his own americans it is president is then his own new  new abc newswashington post came out after gave mental gave trump his  americans after new came out people trump his stability ability in new gave trump stable genius interviewed said  throughout my my mental stability  post NUM percent people it interviewed believed president genius NUM percent  then there mental stability there throughout president stable NUM percent interviewed said NUM percent believed is stable  abc newswashington post DATEthrough NUM NUM NUM interviewed in  NUM  angerer,2018-01-25 16:17:44.789555,2018-02-02 01:19:41.756632,2018-02-02 01:19:41.756664,Trump’s Genius Poll Is Complete & The Results Have Americans Bursting With Laughter,Gloria Christie,,[''],,,
